topic	weight	words
0	0,01125	christus verrijzen jesus dood graf doden alleluja alleluya opstaan sterven maria ten thomas jesum dag hemel wees martha zonde macht 
1	0,00114	vive geus dobbe dop phyllis corydon knapkoek sintruyden cató toscanus port eglise acis oflaet pin phylli pok tswaert tonschuldich oorsaecx 
2	0,02449	maria moeder soon maeght godt hemels groeten godts maghet vol wezen maget dragen baren zuiver bidt kind hoog geboren boven 
3	0,1519	smart ach ziel droef dood zucht hert vol hart pijn tranen klagen zwaar sterven droevig druk rouw verdriet leed treuren 
4	0,01304	hof kleden koningh pracht kroon kleed prins goud slecht pronk sou vorst liever pralen rijk scepter dees rijck veracht koninghs 
5	0,00703	hij ghij wij ende sij alzo iesus kind maghet minnen maagd willen wereld zijd waard maria lof moeder boven kyrieleison 
6	0,0027	t'uwaarts t'uwaart uwaarts uwaart heulen gys lijf lysje jakus hebdy vast emanuel santio vagen weder nouw mert lijsje dese keer 
7	0,00443	wet woord mof heb houden recht rechten knecht gheboden leer weeg bevel waarheid wetten woorden verstand gebod lust geboden bevelen 
8	0,00623	coninck godt spreken noe stad heere drie loth laten mannen ginck dag oven israel noah werpen haer zondaar drinken doe 
9	0,00073	bom din weer lom bore lin dire brilin onder arent witte zang bloemmeken oyvaer naars ontvloogh songh verrijzen haerder koninghsken 
10	0,01099	hun god myn syn volk dies zek dag goed elk steeds nooit heere weg ziel recht staat geven blijven zieden 
11	0,00193	don meriton torment flon onbekend feridon luister spel meritene lyde pene ende koesteren maaghden rekenen verscheiden hierom arent bekomen zwak 
12	0,00367	honing minne zuigen beer bloem bloemen minnespel vliegen abra waar flora zien poot even agh honingh bijtje tong geur lag 
13	0,06079	vijand strijd geweld macht tegen veld strijden sterk bloed kloek hand brengen kracht sijn zwaard slaan menig vrij vechten ten 
14	0,00265	god zeer deur zoo zien vvant med elk huur zonder volk ende leeu aelst vul zulk zal altijd kerk nacht 
15	0,06654	nog dog zeer zoo myn eens magge zoete weg heb leggen zien zult wezen lang zonder ben tij staat zal 
16	0,02071	man vrouw wijf vrouwen vrouwe trouw trouwen mans lijf goed vrou adam twee huis been vouw echt mannen haer huys 
17	0,0027	dier voren ghelijck schijnen tellen breken bergh basan berg voet vruchtbaar ghetal sina zwart rook stout delen kop verstrooid coninghen 
18	0,0018	haag leye tussen pater barbara fal jas met'er off'er klooster plat eerst paar jassen leydzendam isser paters willem horen bezorgd 
19	0,05436	godt gods tijd recht liefde dag scheiden wilt heeren moeten godts god hart fijn werk enten heere eeuwig vrienden laet 
20	0,01232	zoo zeer worden iesus nog onz waar heemels eeuwig goed weereld wees weerelds staat gods deez zelfs heemel nooit gemoed 
21	0,00228	amor hosanna loov fillis hallelujah geef halelujah wit kom heyl quyne geloov nooit fortis lov iehova jehova blonde all davids 
22	0,01417	godts hemels godt worden wereldt godes landt hemel elk woord eeuwig zalig heil wereldts stadt mede staag rijck throon huys 
23	0,01663	deur poort open wacht roepen kloppen botten sluiten treden smal licht eng ziele lampen binnen dwaas waken bruydegom stem weeg 
24	0,02445	waren waard enten dood zaak heeren haren haer zondaar spreken mede twee binnen ten moeten horen laten god lang vier 
25	0,00538	ghoed elk lust maackt enten waard deugd kwaad goods mens gheen waan lieven god dees waarheid zeer zyn zelf elck 
26	0,00948	godt hun naar hen zyn heil zich zal woord opdat zoo myn volk hart vijands zeer heeren loof godts nooit 
27	0,01292	herder schapen schaepkens weide herders wolf harder wacht schaap zoeken schaepken stal voeden slapen wolven arm onder weiden verliezen goed 
28	0,11675	godt vader god wees loven boven geven heere sijn mens prijs godts laet prijzen altijd hart eeuwig lof waard wilt 
29	0,02841	wijn drinken bacchus glas nat wyn vrolijk bier vat eens bachus lustig laet vol edel schenk venus brengen schenken maken 
30	0,00511	godts ramp wort nooit zich zyn hemels zoon jesus zelf kruis naar godt sterk wereld mens vader ooit elk zie 
31	0,00287	zein miin besje datsen waeltje gieren zien waaltje pieter margriet jemie denken hum arent kees lang besjen worden besjes nauw 
32	0,00157	alleen glas waar hendrick zingen waarom zedig weeg grond min beuzeling roep vredig thijs moeten segh dansen dochters fraai dochter 
33	0,26213	waar eens sou lang tijd zieden wees waer ten zondaar blijven toe laten zelf weet haast worden ander soud denken 
34	0,00452	wiens zek sijn worden mits daarom zieden gelijk dit reden dees siet leiden hard thans heden staag heeft bereid aarde 
35	0,07477	vreugde zingen blij deugd vrolijk verheugd vol blijdschap verblijd hert verheugen maken druk hart brengen pijn altijd lust zang dag 
36	0,0448	vreugde twee bruydt wens trouw bruydegom bruyt vrede paar echt liefde geluk deugd band beiden min samen bruyloft mede zegen 
37	0,00526	wijl maagd zen wen pan zei tgun wij toen maagden zede naar stikken gemoed dies hard minn gunnen dianier zoete 
38	0,0279	haer wit roos twee root rood leden mond blank net witte rond wangen handen hert hals glans stralen roosen voorhoofd 
39	0,01198	iesus jesus zijd zegge goodts gelijk toch geven deese vader deesen heel vaêr godt welke ulieden weet zenden mens welk 
40	0,01145	vader heilig soon komt godt hemels drie gheest vier gaaf heyligh godts hart ziel hert verstand eeuwig propheten lof deugd 
41	0,00237	schepper aensiet siet denckt hemel mier schoonheid kortjakje haren ziek hoort geschapen mann vreugde ogen vol blinken vruchten schijn galathe 
42	0,03964	weer lust zieden neer rust uwent kom begeer vrij vreugde ben eens scene staag komt heen dies lang vast blussen 
43	0,00255	zonder dom zondaar sirih brom wij diri voerman heu nar kom weinig slaan prijs lie iicho doet hotsen nest dandara 
44	0,08087	zieden mede siet horen voort weer maken vrij komt toe wort zondaar gaet waer heen eens hout hoort weeg haast 
45	0,01014	end dijn god deinen dyne vrij zek huur fijn myn dijnen volk hebst dyn weeg dyner mit binnen gaar męr 
46	0,02787	geld goed gelt kost ten zorg dag eten koop best god geven rijk kermis huis halen betalen maken wijn sparen 
47	0,03074	laet eens spelen mede vreugde wilt tijd weest zingen lustig komt springen siet drinken vrolijk wezen maken sal eerst spel 
48	0,00924	stad muur ierusalem huis stadt straten jerusalem dochter binnen tempel boven babel bouwen poort syon haer sion goud varen zalig 
49	0,02703	rust nacht slapen slaap lust rusten bed waken lusten droom dromen wacht zacht vrij zorg wakker gerust arbeid stil morgen 
50	0,00209	zijnent dobbe helaas dob nigje licht helas dorst roepen schoen vracht agnes ruiken rob kous munt stier vverckt partuur fluytje 
51	0,09521	volk god hoog macht hand naâm heeren zijne zek ten grond land huis onder heere geslacht sterk rijk over vijand 
52	0,06158	god enten tis wort waard gheen ghelijck int zieden deur elk wart indië maken tijd zulk einde recht brengen hoog 
53	0,02463	vruchten vrucht zaad boom brengen planten woord zaaien groeien vruchtbaar hand dragen bloeien spruit goed wortel laden voort vinden land 
54	0,00192	dansen zingen doort springen zate koster jan waren knipluis lollepot meysken klein lammeken los suiker eten twee bagijnkens voet lijsken 
55	0,09265	ben god ziel heb mijne hert heere mijnen hoop hulp ogen dies oor lang bidden hoog dag gans kracht wilt 
56	0,01483	zich jesus nog myn hert jezus naar dog liefde lam worden gans niets bloed hart vinden alles maak recht vrij 
57	0,00339	gunst zot hoofd eeuwigheid baard dauw likken balsem broeder liefelijk duuren licke goedigheit hout mede hermon vrede siet god wonen 
58	0,0146	n't op't die't syn vaak einde zek dies vanden door't staat jeder deur gelijk doodt wiens scene lach botten hetgeen 
59	0,00149	kik mei sinds cornua cornibus omnibus pierelala kick mayn scho ghay vorssemossels exaltatis deu nayt mein mors nie mossel lors 
60	0,00453	schoen deur lief int groet oeck voer goed tis toch veenes soe god prinse prinses deesen diet hij schoene ten 
61	0,00372	neen heen denken wijs karn leder flonk werk vermaren mening gouverneur soud mits wijsheid sal sotheijt tvoorgaene vorst carel hertogh 
62	0,00125	inder eewicheyt duert goedertierenheid eeuwigheid dueret goetgunsticheyt gheloof sól veruolghers scheid danck hoop swanelijn onder gheduurt ljeafke goedigheid vriendelijk moorghen 
63	0,01696	dijn godt end syn woort heere dies volck dijnen siel eewich loff doot menschen waard naem gheen helpen noot godes 
64	0,14114	wilt hart goed laet altijd vrees wijsheid recht leder heeren waard werk houden zoeken kwaad vast behagen wet weeg tijd 
65	0,08225	spreken man voort vragen vinden heeft horen waren zien woorden sijn aen twee klaar waar worden heen roepen weer terstond 
66	0,16864	god kwaad mens goed waar deugd waard zek recht wanneer alles maken leed vreugde gods geven tijd houden zelf weet 
67	0,03302	lief hart minnen liefde eens waar wilt venus vreugde beminnen wees troost sou mocht ben heb mond treuren princesse allerliefst 
68	0,01646	mey groen bloeien groeien lustig mei bloemkens vreugde elk planten voort zang vruchten pleizant reen virtuut brengen spruit aensiet onder 
69	0,00194	vous mon kwee les qui poeder plus been pour bon suizen coeur que vos touwen pas sans nous dans cessie 
70	0,00991	godt zek ten sijn ren lijk wij kracht node reden haer dies einde tis aard off heil ter gunst diep 
71	0,00142	blom siel mondeken dauwken g'lijck satyrs fles fuyckjen astrea kuss krom eeuvve gentsche saron velerlei vlecht staak syn muwzman schat'ren 
72	0,01892	god hemels godes haer grond waer aard deugd waard wilt welck och ziel goods hemel bidden woord hof g'lijck zond 
73	0,00231	phillis lier let damon tiere tieren amarillis kermis toe coure courage boy nyza kustme siante amaril liegen chloë zel letten 
74	0,0193	hulp sterk macht helpen hand kracht vijand tegen ding vast schild hinder bewaren schaden hoop vallen betrouwen bijstand bouwen troost 
75	0,00304	ian griet hola loure jan claes hans margriet sou kooptmen louw grampeer grietjen toure hou passchier moy teunis bruyloftfeest kees 
76	0,00373	alleen anders leggen weet niemand oorzaak baat menscheliefde streng nagts helpen indien letten wetten oud roosemonde wijn uerlaten vreemde ioffrou 
77	0,0021	vrolijk vrolyk vrolijck weldoen staat vro t'saam gunst hemels eeuwig werken wereld aarde vrede mede schatten dogen smaad zelden haat 
78	0,00121	hout houw canneken vaste fluyt mare paeys vrancrijc paas zoen mits tspaens streyt hongeren proper pauvvels dianneken laetet peeter europa 
79	0,01462	godt ziel godts haren haer vinden blij zelf vreugde troost liefde worden rust klaar hadd wees gheen alleen zaak n't 
80	0,06298	krijgen gelijk eens vol maken heel lijf gat spel zit been hoofd net weet huis mede neus twee lest lopen 
81	0,00463	alzo bruyloft heb goudt sulck noden waren heen best snood koningh gasten bidden wees avontmael straten ossen knecht arion maaltijd 
82	0,086	ben och heb lang eens hert mijnen troost ziel maken waar hart wanneer lief weet zwaar zieden tijd verdriet soud 
83	0,01464	twee honderd drie vijf vis duizend vangen net klok vier jagen cessie jaar slaan acht waren seef jager tien vol 
84	0,07002	lief trouw min ach ben heb hert liefde beminnen wilt spreken trouwen eens jong klagen vrouw wees ander neen zin 
85	0,07809	min ach ziel lief eens hart hert trouw waard smart zin pijn minnen wreed goddin heb vreugde bidden vrouw zieden 
86	0,00208	jaar zot soud maurits dag verloop enten goossen wijn voeren koop kales bedanken graaf kort ijver passen weken wafels rapen 
87	0,00154	uwz fen god gunnen toe mei him naad sil uwt dear ijn hert ney oer for goads ynn trog wol 
88	0,0263	jij kom nauw heb ben eens vrij waar hey nou weet neen och loop sou bent jou moer iou mooi 
89	0,02698	zoo zeer zich zonder zelfs zien staat zal ziet wezen nooit waar elk zult zinnen naar hart zenden zijne vinden 
90	0,03568	brand min venus vier cupido schicht pijl vlam kracht hart wicht klein gezicht minnen branden licht oog vliegen schieten boog 
91	0,00533	dag godt gheen werk enig beelden naast beeld maken ander god zelf suldy vals laatst naâm begeren wijf huis wees 
92	0,0021	boer vos gild mevrouw soldaet mesie snood heersen vostjen vree laura kar kraen christenrijck huysman doden slijpscharen ker gelijk haagstee 
93	0,00936	abraham spreken iacob godt isaac sijn heere man sara heeren iob tobias knecht jacob soon wijf twee nemen dochter lazarus 
94	0,00588	ende ben vader spreken heb wilt beladen weeg zonde ontvangen mijnen godt wereld verstaan aanschouwen oft armen hart zelf woorden 
95	0,0193	weeg wees och klein heere ontvangen bereid weinig rijk uitverkiezen einde eeuwig heeren vrezen blijven broeders prijzen zijde altijd kroon 
96	0,06241	gheen ghelijck gheven sijn iae zelf hert soud ding weet nae deur zieden waar wees noden gemoed hart waard gheest 
97	0,04356	mond min kussen ach kusje kus ziel vreugde eens zoete lipje venus lust kom myn blussen liefde zoo lippen lief 
98	0,04149	groen vee herder harder schaepjes coridon onder min ach herderin gras waer cloris herders veld lief tyter wout harderin weide 
99	0,00336	moyses volk israel aaron woestijn vier beelden afgod moses kalf egypten zulk dathan menigte keren tegen zee plaag korach heeftse 
100	0,02307	kruis lijden bloed kruys dood cruys sijn roepen doden slaan doorn vader hoofd dragen lam wonden pijn hout hart mens 
101	0,00547	arm sijn blijven heeft goedheid heerlijk vol vrij alle duren barmhartigheid god maken end rijk vrees grond sterk achten genade 
102	0,00269	deur kleur houje leen oordje woortje weeg boom dag kaf wet nacht waard vergaan welk blad zondaar wind spotter godloosen 
103	0,00505	tsa tha lusjes kusje hertje lachje ooit nachjes suchjes oogen vrij mary kusjes geesje kluchjes gedachjes lonkje zieltje roseliine lonckjes 
104	0,07971	christus gods wart christum mens waarheid heeren kwaad vlees paulus god liefde klaar worden horen godts spreken woorden hoog dit 
105	0,03747	gods godt heere gheen zondaar enten end elk onder vrij menschen ghelijck nae god heeren zulk oock laet ding werk 
106	0,00899	prins paus graef geusen moeten stad steden menig geus jck prince edel spaengiaerts schepen haerlem slaan lant godt binnen willen 
107	0,00219	graef velsen proper floris godt dieu hemel gerrit geeraert zang blijven vrij koninghinne wip selv zaad griet gehoor hoog geweld 
108	0,00205	bom baard droefheid bommelalire hond hondt welcke welke sohay stront hou zaaien behoeftmen brouwen quickmen dom condy procris toe mars 
109	0,00211	thee pover vissen schöne wilje zede volgen hand chevael fille zou und belle rarikiek portugael kijk keel vyva get hengel 
110	0,04013	min liefde hert hart beminnen smart minnen zin nooit alleen ziel vrij neen zoo myn minnaar zinnen trouw nimmer gloed 
111	0,01647	end godt hen zien myn n't wees gans kracht deur maken volk dies prijzen tijd gemeen spreken wilt alleyn vol 
112	0,04218	lijden druk kruis verblijden zwaar strijd verdriet troost lijd strijden leiden noot worden ten god leed pijn tijden dragen moeten 
113	0,00562	venus helena paris mars troyen goon goden pallas heleen griecken juno net doden heeft sijn cupido oock jupijn iuno verkeer 
114	0,01	godt hun fijn heere glijck worden vijand oock godts volk dies ghelijck siel vrij zeer vanden mijnen daerom woord helpen 
115	0,00385	kom toch zidel godt vvy myn vvat waard zyn altyt gelijk kool vvaer n't heere ymandt zijde vvie gemoet kaatjes 
116	0,01408	och doodt naem heel godt me'e gunst dit waard gods steeds mensch vast vrees worden ziele deucht uyt jeucht heeren 
117	0,03056	godt godts hert woord mens mensch godes waer doden waar blijven kwaad woordt eeuwig hoop weeg nochtans lijf ding menschen 
118	0,04536	water mens zee hoog vee dier hemel aard vier maken bergen grond over kracht regen alles lucht zingen wind werk 
119	0,0403	spijs brood eten drank drinken wijn dorst honger vlees dit lichaam voeden bloed tafel broden eed geven laven vol spijzen 
120	0,00253	tijdt tuk couragie wit eens enigheid leeuw vangen levertje dief lie bogaert rosamondi rosa cra raken weyman katers isabel cras 
121	0,02839	zich worden naar zelf nooit zeer zal eens weder waar hun wezen zyn zult hen staat tij niets magge nog 
122	0,00331	dijn dij hij god daphne toch bestuyren zes roepen edom worden dijnen boom wij over deernis stralen zek vier selah 
123	0,00739	hun hen stellen spaer verheffen schieten monden hunnen tenten gloed neerwaarts verslondt hoogsten hunn beginsel dogh sleep melden nestor kloot 
124	0,02025	godt sint godes hemels hart haer doden godts goods ziel sijn deugd lof noden geloof kerck vroom aen woord iesu 
125	0,08053	wereld godt vreugde ziel kwaad lust vlees zoeken lusten rust zin god vinden alleen dienen beminnen schijn ijdelheid deugd mens 
126	0,00322	god doop hemel belofte gheest quam ontvangen vervuld vol ten petrus vruchten desen alleyn heeft zulk haer tong godt reen 
127	0,01822	sterven derven doden dood verwerven erven blijven sal boire gunst lang sterfte altijd beërven bederven lieven sterve derf hoop even 
128	0,02961	zee schip varen wind baren ree weer winden schipper zeil water mede land brengen storm boord haven reis heen menig 
129	0,04461	lof prijs loven looft sijn zingen naâm hoog god dank boven werk heere heeren grond goedheid macht mond kracht hemel 
130	0,02428	kind stal mens godt klein geboren kindt moeder arm leed doek kinnetje vinden gheboren bethlehem nacht beest teer brengen sus 
131	0,09099	licht dag gezicht son nacht ogen oog zon hemel glans stralen klaar dalen duister hemels verdwijnen wanneer schijnen schijn ten 
132	0,00313	wiegen geldt patiency alexander trooster tong maet wereld best dochter horen koppen blank kop indien dingen rechte proef klooster ter 
133	0,01008	zoo goods kerk deur waard zeer christus godes nieuw wezen eerst end nae iae christen toe weer hen zonder aen 
134	0,07862	deugd hoog waard vol schoonheid roem glans ieder vreugde lof kroon scholen reden boven wiens waardig gunst goud min leden 
135	0,0022	zien sijn verbetering loeder top keel poot gaede heel dag toer hoofd grond taback neus duizend zat gloria maag franck 
136	0,01147	ach sal min wreed dood trouw borst laura titer laas hemel mede graf voeren straf droef snood n't vaak lucht 
137	0,06642	heere godt bidden dijn wilt ziel vader troost hart noot genade god gheeft helpen altijd helpt heilig maken zonde kwaad 
138	0,10873	god gods geloof mens woord dood kracht waar zelf godes dit waard eigen leer wet ten recht geven werk goed 
139	0,08194	zonde laet ziel jesu siet liefde wilt godt doden hert bloed zondaar komt iesu mens vol eeuwig aen beminnen wonden 
140	0,00097	qui nobis cum non rex nos iesv quàm gloriae quem gloria hic quid dulcis dei natus quam nunc sed quae 
141	0,12859	zien denken roepen laten scheen weer nemen lach haast doe haer wier geven worden heen brengen heel hand viel waren 
142	0,00381	wederom keert keren gevallen weder waer weer sulamite aard biron bijten rug zijt karn molenaar levend zijd bloed baren wonden 
143	0,0122	vrij meysje vrijen vryers vryer trouwen aardig meisje ander minnen meysjes vrijster wagen praat vrijer min deur lust hartje behagen 
144	0,00191	unde mit zijd und werlt roer waerheydt rijck schiet dronck t'is voer dach schoot schieten machmen verblijdt werdt wayman aerden 
145	0,04852	vader moeder kind spreken dochter god man nemen huis geven vaders waar broeder dood brengen goed ten jong bloed laten 
146	0,01405	nieuw iaer nieuwen jaer ster herodes klaar int jaar bethlehem waar gheboren kinnetje wilt iare nieuwe dag voorwaar nieuwejaer waren 
147	0,00136	heyligt brant vro ben tan magge benedicamus wezen domino aangaande zien toereloere borsjens lucht genoeg behoeder ave wesel slecht bos 
148	0,00524	zeer oock zoo ginck dese gods godt worden petrus eerst nae alzo coninck gekomen bekeren zenden syn wort iesus verklaren 
149	0,00229	ich das mein vnnd mir mich ein nitt zei dir sein dich hertz lieb jch mitt hab dein woll hatt 
150	0,00403	boer viva boeren hun daerje werk sou maken oorlof g'heel ieder meest gaar heeren worden altijd dief kunnen edel moeten 
151	0,05587	hert eens gheen min mijnen oft n't liefde ben minnen wees laet naer beminnen toch heel wilt vinden sou t'is 
152	0,04249	liefde lief hart troost pijn enten hert reen zwaar dood vreugde deur heel alleen voorwaar druk dienaar/diener venus verdriet eerbaar 
153	0,01149	comt deur lieffd venus lieffde goden lieff diana reen phoebus apollo pallas pan vol aurora flora cupido groen enten oock 
154	0,04767	klaar reen lof zondaar vreugde hemels scholen deugd boven bruydegom troon wilt haer godts fijn godt wees liefde prijzen zijd 
155	0,00315	vol ach zieden sol n't siet kracht jeucht gans maecht op't trou trots pronckje ent glansje deftig kransje veetje diaen 
156	0,06819	kwaad boos tong haer mens recht spreken vol god vrome zieden tegen vals mond goddeloos hart haat boosheid scene sijn 
157	0,09125	ander zelf elk anders ieder eens eigen weet best maken vriend waar meest goed raad worden woord dienen zaak man 
158	0,00516	tong woorden reden minne foey geil rede venijn zot houden praat achterklap wind gek jong garen praten zede eigen klap 
159	0,00941	adieu jck heb groen scheiden blijven ben vrienden horen liefste lust zoetjes moeten brengen veld botten gerust uyt huis verbeiden 
160	0,03567	godt wilt kwaad zonde godts mens deugd eeuwig zondaar goed oordeel werk tijd doden altijd daerom loon noden bekeren doet 
161	0,0453	tijd eeuwig dood mens doden sterven vergaan haast wereld och einde kort rijk lang moeten dag worden graf hel ziel 
162	0,00369	waarheid naâm vals christen schijn leugen mond bedriegen daad noemen veinzen kennis mom liegen roemen heet lest schrijven waan gemoet 
163	0,05781	god heere enten ende dood wart gods gheen zondaar wereld wilt uan indië rijk verheffen sijn gheuen mens godt zonde 
164	0,00647	nog hemel hert zich hemels zieden sijn oog leggen ten eeuwig ligt heen staat heyl maackt zondaar heylig scene werelds 
165	0,01436	vrede twist vol mede haat peis nijd elk strijd mens deur eendracht zoeken rust vree wonen oorlog gemeen tweedracht scheiden 
166	0,12264	bloed straf snood wreed boos kwaad wraak vol zelf worden fel haat tegen vals vrij schande toorn over plagen spijt 
167	0,00137	kyrie fijn pieragie eleison heere ten weder vol sonne welcoom laet schijnen geven pijnen niemandt regen chiambriere haal nae ouy 
168	0,07652	zondaar enten vrij klaar vol zwaar snel zaad dood kwaad elk noot fel sonder eeuwig ten haer deur bloot zenden 
169	0,00632	iesus iesu alleluia zijd heilig christ kinnetje zek geboren godes soon heyligheyt zondaar lieven zingen iesum waar genaed fijn gans 
170	0,00797	hert noden laet heen ach woord kracht hulp ramp oog mond mijne waer moed recht oor wech laten ten noyt 
171	0,01246	godt godts hert deugd waer boven goed vreugde liefde eeuwig licht wonder heeft ziel vier nen altijd loven scene hen 
172	0,01943	nog spreken mede toen heb worden toe klaar ben pleizier hoord man juffrouw vrouw kind heel meysje eens dogter drie 
173	0,00272	verdriet wijsheid yder even ruw heylighe len loopt stelt duren heylige drijven noegden meedeelden wikken zang letter beleggen neemtse naso 
174	0,00421	david elias saul achab israel gods naboth baal volk dauid straf propheten goliath propheet doden davids salomon nabal ras israels 
175	0,00973	lief alzo dag over och rijden ruyter groen klein stout moede zingen fijn meisje leed dragen nacht drie lang jij 
176	0,01254	myn hert hun godt altydt hadd gheen oft hebb naer maken ghelyck vier sal uyt alleen jesus maeght deês syn 
177	0,05058	liefde lieven hert liefd hart min ziel minnen beminnen zin lief kracht blijven waard gemoed brand binnen ontsteken deugd grond 
178	0,02192	zingen zang stem geluid spel spelen hoog lof oor keel horen fluit snaar kwelen snaren toon klank onder klinken gezang 
179	0,03328	tijd jaar jong oud jeugd dag oude vreugde nieuw dagen wens gelijk beginnen dienen lang iaren grijs ouderdom deugd sparen 
180	0,0057	heere hart ende ghij zidel gratie wilt jesus altyt hij ziel wijl liefde tijd zelf zonde zeer laet leiden myn 
181	0,00238	schaar kerkhof vlas roepje vleesch steen mesje mes sliep tonen schier laburdon elsselijn zwart daerom tierelieron leunis kooren fraai pater 
182	0,03406	zonde kwaad schuld heb genade zond vergeven ben zenden misdaad straf sonde ziel over straffen mijne misdoen zwaar zondaar wonden 
183	0,00596	west oost bloed zieden moeder zuid oosten noord kind waard eerst teder jong rachel westen herodes oor vers troosten schort 
184	0,00551	satan wilt kwaad zondaar goed nieuw doet teghen vruchten vroom sal loop zwaar vlees hoofd job dood duyvel kroon vallen 
185	0,00869	toch god vrienden laet och godt moeten horen vroom laten zuster kinderen enten haer vrede vader lief broeder groet goed 
186	0,00231	hansken menen amarilli toe jeck val miede zien und bie man eyn ein nicht ich ond noe gans durch wier 
187	0,00593	dijn deur ten noyt zulk jck naer princesse knecht noden gans edel onder maagd weet duizend vast heden geheel mijnen 
188	0,0021	hun dijn volk land stad romen gods god kerk zek maraen heren worden bosch godes heil lang spaensche prinz tis 
189	0,01345	prins weer land oranje heel schepen koning mede kant aen verheven horen vloot edel spanjen helden over kroon roepen lang 
190	0,00252	christus deugd ende liefde meyboom sijn mey eeuwig jok wilt groen water laurens zonde zingen wort sonde heilig wet verwinnen 
191	0,00656	ioseph volk israel pharao egypten daniel godt moses sarila koning zee doe pharo rood susanna bel steen broeders leeuwen israël 
192	0,00501	christus spreken water vrouken ende iesus heere vol bidden sprack zelf hoort drinken prijzen zondaar wilt tempel pharizeen iesum verstaan 
193	0,00289	duren strekken zek wijd wee veer altijd goedheid mier mildheyd immerimmermeer sijne evoë goedtheydt evoẽ geleide oude vrij haastig mal 
