topic	weight	words
194	0,00838	vriend sijn onder mijnen liefelijk lief ogen ben ghelijck barsten reuk mijne vriendin scholen wijn gelijk liefste zieden siet stem 
195	0,09267	ziel lust goed hoog rust hert schat gemoed vinden zek waar zelf vrij alles vreugde wens aard oog dwaas hart 
196	0,00624	hun godt geven waar vreugde kwaad wees gods eeuwig vrome dood nooit deese naar licht oock staat zieden sal weer 
197	0,03286	groen mey winter veld kruid tijd bloemen weer zingen velden vol vreugde gras liefelijk springen aangenaam lucht bomen blad ieder 
198	0,00662	vvant vvat vvilt vvil vvaer vvie weder uvven foire vvel vvanneer wezen n't maagd vvaerom vrolikheyt may vvas faderie ladron 
199	0,07178	ziel eeuwig heil kracht gunst ach hert ten steeds kom genade goed leggen hart zidel eens alles nooit waar weg 
